{
  "attention_backend": "sdpa",
  "command": "/workspace/openlanguagemodel/benchmarks/demo2026/scaling/run_olm.py --config benchmarks/demo2026/configs/scaling/llama400m.yaml --gpu-count 4 --replicate 1 --output benchmarks/demo2026/results/raw/scaling",
  "compile": false,
  "config": {
    "framework": "olm",
    "gpu_counts": [
      1,
      2,
      4,
      6
    ],
    "gpu_model_expected": "NVIDIA A100-SXM4-80GB",
    "interconnect": "nvlink",
    "model": {
      "dropout": 0.0,
      "embed_dim": 1024,
      "intermediate_size": 2816,
      "max_seq_len": 2048,
      "num_heads": 16,
      "num_kv_heads": 4,
      "num_layers": 28,
      "rope_theta": 500000.0,
      "tie_weights": true,
      "vocab_size": 32000
    },
    "name": "llama400m",
    "replicates": [
      0,
      1,
      2
    ],
    "training": {
      "attention_backend": "sdpa",
      "compile": false,
      "fused_optimizer": false,
      "grad_accum_steps": 1,
      "learning_rate": 0.0003,
      "local_batch_size": 1,
      "measured_steps": 200,
      "optimizer": "adamw",
      "precision": "bf16",
      "seed": 42,
      "sequence_length": 2048,
      "synthetic_ring_size": 64,
      "warmup_steps": 50,
      "weight_decay": 0.1
    }
  },
  "config_hash": "5089cad70664f5aa",
  "environment": {
    "cuda_available": true,
    "cuda_version": "13.0",
    "cudnn_version": 92000,
    "driver_version": "580.126.16",
    "env_vars": {
      "CUDA_VISIBLE_DEVICES": "0,1,2,4,5",
      "LOCAL_RANK": "0",
      "MASTER_ADDR": "9ded10c033d1",
      "MASTER_PORT": "35145",
      "OMP_NUM_THREADS": "1",
      "RANK": "0",
      "WORLD_SIZE": "4"
    },
    "git_dirty": false,
    "gpu_count": 5,
    "gpu_models": [
      "NVIDIA A100-SXM4-80GB",
      "NVIDIA A100-SXM4-80GB",
      "NVIDIA A100-SXM4-80GB",
      "NVIDIA A100-SXM4-80GB",
      "NVIDIA A100-SXM4-80GB"
    ],
    "hostname": "9ded10c033d1",
    "litgpt_version": null,
    "nccl_version": "2.29.7",
    "numpy_version": "2.5.1",
    "olm_commit": "898850dd38bb82deb8db713aa979efc48e842080",
    "olm_version": "2.2.0",
    "platform": "Linux-6.8.0-100-generic-x86_64-with-glibc2.35",
    "python_version": "3.12.13 (main, Mar  4 2026, 09:23:07) [GCC 11.4.0]",
    "timestamp_utc": "2026-07-16T09:41:32.929706+00:00",
    "torch_version": "2.13.0+cu130",
    "transformers_version": "5.14.0"
  },
  "framework": "olm",
  "framework_version": "2.2.0",
  "global_batch_size": 4,
  "gpu_count": 4,
  "gpu_model": "NVIDIA A100-SXM4-80GB",
  "grad_accum_steps": 1,
  "interconnect": "nvlink",
  "local_batch_size": 1,
  "loss_first": 68.42327117919922,
  "loss_last": 28.225040435791016,
  "loss_trace": [
    68.42327117919922,
    66.96243286132812,
    67.5742416381836,
    67.06468200683594,
    66.3329086303711,
    66.71124267578125,
    66.74810791015625,
    65.17638397216797,
    64.52196502685547,
    64.24552917480469,
    64.03028869628906,
    63.66562271118164,
    63.61965560913086,
    63.116817474365234,
    63.07567596435547,
    61.90290832519531,
    62.376800537109375,
    60.95439910888672,
    61.46836853027344,
    59.28590774536133,
    60.96090316772461,
    60.81086730957031,
    57.669944763183594,
    58.66533279418945,
    58.85784149169922,
    60.1765251159668,
    58.14122772216797,
    58.67285919189453,
    56.83982467651367,
    57.41196060180664,
    55.3428955078125,
    56.107337951660156,
    55.48363494873047,
    57.71867370605469,
    54.11393356323242,
    55.94157791137695,
    55.42365264892578,
    55.1258544921875,
    54.04024124145508,
    53.35066604614258,
    53.327598571777344,
    52.89067840576172,
    54.24711608886719,
    54.478641510009766,
    52.59332275390625,
    52.32532501220703,
    53.074317932128906,
    52.65287780761719,
    50.33268356323242,
    52.158477783203125,
    51.971771240234375,
    50.70258331298828,
    51.74201583862305,
    51.011539459228516,
    51.06975173950195,
    50.34086608886719,
    49.68650817871094,
    49.78664016723633,
    50.168601989746094,
    50.26789093017578,
    49.351810455322266,
    49.3104248046875,
    48.62516784667969,
    48.706459045410156,
    48.39061737060547,
    47.26903533935547,
    47.76195526123047,
    48.013221740722656,
    47.095733642578125,
    47.82701873779297,
    47.80072784423828,
    47.0701789855957,
    45.804256439208984,
    46.35913848876953,
    45.601444244384766,
    45.700599670410156,
    45.31561279296875,
    45.60152053833008,
    45.99829864501953,
    45.64663314819336,
    45.53273010253906,
    44.28676223754883,
    44.93367004394531,
    43.018699645996094,
    44.32258987426758,
    44.414371490478516,
    41.762229919433594,
    42.64713668823242,
    43.15182113647461,
    42.80570602416992,
    42.32149124145508,
    43.040042877197266,
    41.35135269165039,
    42.293678283691406,
    40.545814514160156,
    41.31966018676758,
    40.46134567260742,
    42.92971420288086,
    39.71807861328125,
    41.06428527832031,
    40.93095016479492,
    40.518333435058594,
    39.857200622558594,
    39.359535217285156,
    39.39719772338867,
    39.11855697631836,
    40.20823287963867,
    40.733619689941406,
    38.75821304321289,
    38.764976501464844,
    39.49384689331055,
    39.3634147644043,
    37.281158447265625,
    38.66044998168945,
    38.677669525146484,
    37.58372116088867,
    38.77897644042969,
    38.03102111816406,
    38.43233871459961,
    37.5876579284668,
    36.9118537902832,
    37.21206283569336,
    37.622161865234375,
    37.44278335571289,
    37.079505920410156,
    37.0635986328125,
    36.21546936035156,
    36.53028869628906,
    36.43370056152344,
    35.3739013671875,
    35.789249420166016,
    36.36506271362305,
    35.40205001831055,
    36.108131408691406,
    35.93301010131836,
    35.69038391113281,
    34.165287017822266,
    35.04492950439453,
    34.35365676879883,
    34.62727355957031,
    34.14289093017578,
    34.52437973022461,
    35.387733459472656,
    35.28419494628906,
    34.89701461791992,
    33.80158615112305,
    34.365413665771484,
    32.75038146972656,
    33.861717224121094,
    34.09161376953125,
    31.775218963623047,
    32.40586853027344,
    33.0071907043457,
    32.00859451293945,
    32.14815902709961,
    33.008121490478516,
    31.429088592529297,
    32.37811279296875,
    31.108436584472656,
    31.876970291137695,
    31.035829544067383,
    33.338130950927734,
    30.38370132446289,
    31.478933334350586,
    31.50809097290039,
    31.118907928466797,
    30.706323623657227,
    30.375595092773438,
    30.504091262817383,
    30.157958984375,
    30.99787712097168,
    31.577049255371094,
    29.758441925048828,
    30.03302001953125,
    30.593612670898438,
    30.717987060546875,
    29.010107040405273,
    29.994565963745117,
    29.930477142333984,
    29.246610641479492,
    30.30063819885254,
    29.69236946105957,
    30.033126831054688,
    29.312957763671875,
    28.667287826538086,
    28.955636978149414,
    29.413761138916016,
    29.182111740112305,
    28.990291595458984,
    29.091718673706055,
    28.27383041381836,
    28.714384078979492,
    28.7198486328125,
    27.69991111755371,
    28.148860931396484,
    28.79602813720703,
    27.909334182739258,
    28.496992111206055,
    28.23036766052246,
    28.225040435791016
  ],
  "mean_step_time_ms": 126.50918601989746,
  "measured_steps": 200,
  "model": "llama400m",
  "optimizer": "adamw",
  "parameters": 348447744,
  "peak_memory_gb_per_gpu": [
    10.465641984
  ],
  "precision": "bf16",
  "replicate": 1,
  "reportable": true,
  "seed": 43,
  "sequence_length": 2048,
  "step_time_std_ms": 1.4605950632042692,
  "tokens_per_second": 64754.19104120673,
  "warmup_steps": 50
}
